reference_number,title_en,title_fr,minister,question_en,question_fr,date_received,response_en,response_fr,background_en,background_fr,additional_information_en,additional_information_fr
,Bill C-58 (Access to Information Reform),Projet de loi C-58 (réforme de l'accès à l'information),PM,What is the Government doing to reform the Access to Information Act (Bill C-58)?,Que fait le gouvernement pour réformer la Loi sur l'accès à l'information (projet de loi C-58)?,2019-11-25,"* Bill C-58 contains the first significant amendments to the Access to Information Act since it was introduced over three decades ago. 
* This Bill is the first phase of a two-step approach to update access to information. The targeted changes will be followed by a full review of the Act in Phase II, to begin within one year of royal assent. 
* The Government thanks the members of the Senate Committee on Legal and Constitutional Affairs for their careful review of Bill C-58.","* Le projet de loi C-58 contient les premières modifications importantes touchant la Loi sur l’accès à l’information depuis l’adoption de celle-ci il y a plus de trente ans. 
* Le projet de loi C-58 est la première phase d’une approche en deux étapes qui vise à mettre à jour l’accès à l’information. Les changements visés seront suivis d’un examen complet de la Loi au cours de la deuxième phase, qui commencera dans l’année suivant la sanction royale du projet de loi. 
* Le gouvernement remercie les membres du Comité sénatorial permanent des affaires juridiques et constitutionnelles pour l’examen approfondi du projet de loi C-58 qu’ils ont effectué.",Government of Canada institutions subject to the [Access to Information Act](http://laws-lois.justice.gc.ca/eng/acts/a-1/) (ATIA) are required to post summaries of processed ATI requests.,Les institutions du gouvernement du Canada visées par la [Loi sur l’accès à l’information](http://laws-lois.justice.gc.ca/fra/lois/a-1/) (LAI) sont tenues de publier les sommaires des demandes d’accès à l’information qu’elles ont traitées.,"The Government will continue to work with the Information Commissioner, parliamentarians, and other stakeholders to further strengthen government openness and transparency.","Le gouvernement continuera de travailler avec la commissaire à l’information, les parlementaires et d’autres intervenants afin d’être encore plus ouvert et transparent. "
