fiscal_yr,service_id,service_name_fr,service_description_fr,service_type,service_recipient_type,service_scope,client_target_groups,program_id,client_feedback_channel,automated_decision_system,automated_decision_system_description_fr,service_fee,os_account_registration,os_authentication,os_application,os_decision,os_issuance,os_issue_resolution_feedback,os_comments_client_interaction_fr,last_service_review,last_service_improvement,sin_usage,cra_bn_identifier_usage,num_phone_enquiries,num_applications_by_phone,num_website_visits,num_applications_online,num_applications_in_person,num_applications_by_mail,num_applications_by_email,num_applications_by_fax,num_applications_by_other,special_remarks_fr,service_uri_fr
INVALID,1001,Prestations de la Sécurité de la vieillesse,"La pension de la Sécurité de la vieillesse (SV) est une prestation mensuelle versée à la plupart des Canadiens âgés de 65 ans et plus qui satisfont aux exigences relatives au statut juridique et à la résidence au Canada. En plus de la pension de la Sécurité de la vieillesse, il existe trois types de prestations de la Sécurité de la vieillesse : le Supplément de revenu garanti, l'Allocation et l'Allocation au survivant. La SV verse chaque année un soutien financier à des millions d'aînés, incluant ceux à faible revenu.
",RES,CLIENT,EXTERN,PERSON,BGN01,"EML,FAX,PERSON,ONL,POST,TEL",N,,N,Y,Y,Y,Y,Y,Y,,,2021-2022,Y,Y,7252346,0,5446484,276390,0,792026,0,0,2218002,"- Le volume indiqué dans la colonne « Demandes par la poste » comprend le volume de demandes papier pour les types de demandes de prestations de pension de la SV suivants : pension de base de la SV ; le Supplément de revenu garanti (SRG); Allocation ; Allocation de survivant ; Renouvellement du SRG/Allocation/ Allocation de survivant ; options pour le SRG/l'allocation/l'allocation de survivant ; et les prestations étrangères.
- Le volume indiqué dans la colonne """"Nombre d'inscriptions automatiques"""" représente le volume des inscriptions automatiques à la pension de base de la SV et au SRG.
- Le volume reflété dans la colonne « Demandes par d'autres canaux » représente le volume d'adhésion automatique à la pension de base de la SV et du SRG, ainsi que le renouvellement automatique des prestations fondées sur le revenu par l'intermédiaire de l'ARC pour le SRG.
- Les demandes de prestations de pension de la SV ne constituent pas le plus gros volume de travail effectué par le programme de la SV. En plus des demandes, il y a eu également 3 143 898 autres révisions des comptes de SV et de prestations étrangères en 2022-2023
- Les demandes de renseignements téléphoniques sur la SV et le RPC sont gérées par le même service téléphonique sans frais des pensions, avec un chevauchement important entre les deux programmes pour de nombreux appels. Les mesures rapportées pour le RPC et la SV, comme le volume d'appels, sont donc identiques et non cumulatives (c'est-à-dire qu'elles ne doivent pas être additionnées). ""
",https://www.canada.ca/fr/services/prestations/pensionspubliques/rpc/securite-vieillesse.html
